,poem_line,nazm_name,author_name
1248,تو اے نیک دل لڑکیو الوداع,نیک دل لڑکیو,عباس اطہر
1249,یاد رکھنا ہماری حقیقت سے گزرو تو آنسو بہا کر دعا مانگنا,نیک دل لڑکیو,عباس اطہر
1250,قیدیوں شاعروں اور محکوم آبادیوں کے لئے,نیک دل لڑکیو,عباس اطہر
1251,اور بیمار بچوں کی ماں کے لئے,نیک دل لڑکیو,عباس اطہر
1252,اور اس کے لئے جو تمہارے بدن کا مسافر ہے لیکن,نیک دل لڑکیو,عباس اطہر
1253,ہمارے سفر کی شہادت ہے,نیک دل لڑکیو,عباس اطہر
1254,اندھیری شام کے ساتھی,ادھوری نظم,عباس تابش
1255,ادھوری نظم سے زور آزما ہیں,ادھوری نظم,عباس تابش
1256,بر سر کاغذ بچھڑنے کی,ادھوری نظم,عباس تابش
1257,سنو ۔۔۔تم سے دل محزوں کی باتیں کہنے والوں کا,ادھوری نظم,عباس تابش
1258,یہی انجام ہوتا ہے,ادھوری نظم,عباس تابش
1259,کہیں سطر شکستہ کی طرح ہیں چار شانے چت,ادھوری نظم,عباس تابش
1260,کہیں حرف تمنا کی طرح دل میں ترازو ہیں,ادھوری نظم,عباس تابش
1261,سنو۔۔۔ ان نیل چشموں سخت جانوں بے زبانوں پر,ادھوری نظم,عباس تابش
1262,جو گزرے گی سو گزرے گی,ادھوری نظم,عباس تابش
1263,مگر میں اک ادھوری نظم کی ہیجان میں کھویا,ادھوری نظم,عباس تابش
1264,تمہیں آواز دیتا ہوں,ادھوری نظم,عباس تابش
1265,کہ تنہا آدمی تخلیق سے عاری ہوا کرتا ہے,ادھوری نظم,عباس تابش
1266,جان من!,ادھوری نظم,عباس تابش
1267,سنو۔۔۔ میرے قریب آؤ,ادھوری نظم,عباس تابش
1268,کہ مجھ کو آج کی رات اک ادھوری نظم پوری کر کے سونا ہے!,ادھوری نظم,عباس تابش
1269,کسی کے بعد,وہ ہنستی ہے تو اس کے ہاتھ روتے ہیں,عباس تابش
1270,اپنے ہاتھوں کی بد صورتی میں کھو گئی ہے وہ,وہ ہنستی ہے تو اس کے ہاتھ روتے ہیں,عباس تابش
1271,مجھے کہتی ہے تابشؔ! تم نے دیکھا میرے ہاتھوں کو,وہ ہنستی ہے تو اس کے ہاتھ روتے ہیں,عباس تابش
1272,برے ہیں ناں؟,وہ ہنستی ہے تو اس کے ہاتھ روتے ہیں,عباس تابش
1273,اگر یہ خوب صورت تھے تو ان میں کوئی بوسہ کیوں نہیں ٹھہرا'',وہ ہنستی ہے تو اس کے ہاتھ روتے ہیں,عباس تابش
1274,عجب لڑکی ہے,وہ ہنستی ہے تو اس کے ہاتھ روتے ہیں,عباس تابش
1275,پورے جسم سے کٹ کر فقط ہاتھوں میں زندہ ہے,وہ ہنستی ہے تو اس کے ہاتھ روتے ہیں,عباس تابش
1276,صراحی دار گردن نرم ہونٹوں تیز نظروں سے وہ بد ظن ہے,وہ ہنستی ہے تو اس کے ہاتھ روتے ہیں,عباس تابش
1277,کہ ان اپنوں نے ہی اس کو سر بازار پھینکا تھا,وہ ہنستی ہے تو اس کے ہاتھ روتے ہیں,عباس تابش
1278,کبھی آنکھوں میں ڈوبی,وہ ہنستی ہے تو اس کے ہاتھ روتے ہیں,عباس تابش
1279,اور کبھی بستر پہ سلوٹ کی طرح ابھری,وہ ہنستی ہے تو اس کے ہاتھ روتے ہیں,عباس تابش
1280,عجب لڑکی ہے,وہ ہنستی ہے تو اس کے ہاتھ روتے ہیں,عباس تابش
1281,خود کو ڈھونڈتی ہے,وہ ہنستی ہے تو اس کے ہاتھ روتے ہیں,عباس تابش
1282,اپنے ہاتھوں کی لکیروں میں,وہ ہنستی ہے تو اس کے ہاتھ روتے ہیں,عباس تابش
1283,جہاں وہ تھی نہ ہے، آئندہ بھی شاید نہیں ہوگی,وہ ہنستی ہے تو اس کے ہاتھ روتے ہیں,عباس تابش
1284,وہ جب انگلی گھما کر,وہ ہنستی ہے تو اس کے ہاتھ روتے ہیں,عباس تابش
1285,فیضؔ کی نظمیں سناتی ہے,وہ ہنستی ہے تو اس کے ہاتھ روتے ہیں,عباس تابش
1286,تو اس کے ہاتھ سے پورے بدن کا دکھ جھلکتا ہے,وہ ہنستی ہے تو اس کے ہاتھ روتے ہیں,عباس تابش
1287,وہ ہنستی ہے تو اس کے ہاتھ روتے ہیں,وہ ہنستی ہے تو اس کے ہاتھ روتے ہیں,عباس تابش
1288,عجب لڑکی ہے,وہ ہنستی ہے تو اس کے ہاتھ روتے ہیں,عباس تابش
1289,پورے جسم سے کٹ کر فقط ہاتھوں میں زندہ ہے,وہ ہنستی ہے تو اس کے ہاتھ روتے ہیں,عباس تابش
1290,مجھے کہتی ہے ''تابشؔ! تم نے دیکھا میرے ہاتھوں کو,وہ ہنستی ہے تو اس کے ہاتھ روتے ہیں,عباس تابش
1291,برے ہیں ناں''؟,وہ ہنستی ہے تو اس کے ہاتھ روتے ہیں,عباس تابش
1292,میں شاید گر چکا ہوں اپنی نظروں سے,وہ ہنستی ہے تو اس کے ہاتھ روتے ہیں,عباس تابش
1293,میں چھپنا چاہتا ہوں اس کے تھیلے میں,وہ ہنستی ہے تو اس کے ہاتھ روتے ہیں,عباس تابش
1294,جہاں سگریٹ ہیں ماچس ہے,وہ ہنستی ہے تو اس کے ہاتھ روتے ہیں,عباس تابش
1295,جو اس کا حال ماضی اور مستقبل!,وہ ہنستی ہے تو اس کے ہاتھ روتے ہیں,عباس تابش
1296,عجب لڑکی ہے,وہ ہنستی ہے تو اس کے ہاتھ روتے ہیں,عباس تابش
1297,آئے تو خوشی کی طرح آتی ہے,وہ ہنستی ہے تو اس کے ہاتھ روتے ہیں,عباس تابش
1298,اسے مجھ سے محبت ہے,وہ ہنستی ہے تو اس کے ہاتھ روتے ہیں,عباس تابش
1299,کہ شاید مجھ میں بھی بد صورتی ہے اس کے ہاتھوں کی!,وہ ہنستی ہے تو اس کے ہاتھ روتے ہیں,عباس تابش
1300,صف ماتم بچھی ہے,ابھی اس کی ضرورت تھی,عباس تابش
1301,سخن کا آخری در بند ہونے کی خبر نے,ابھی اس کی ضرورت تھی,عباس تابش
1302,کھڑکیوں کے پار بیٹھے غمگساروں کو,ابھی اس کی ضرورت تھی,عباس تابش
1303,یہ کیسی چپ لگا دی ہے,ابھی اس کی ضرورت تھی,عباس تابش
1304,یہ کس کی ناگہانی موت پر سرگوشیوں کی آگ روشن ہے,ابھی اس کی ضرورت تھی,عباس تابش
1305,کسی کے کنج لب سے کوئی تارا میرے دل پر آن پڑتا ہے,ابھی اس کی ضرورت تھی,عباس تابش
1306,برا ہو موت کا جس نے مرے فریاد رس کی جان لے لی ہے,ابھی اس کی ضرورت تھی,عباس تابش
1307,ابھی اس کی ضرورت تھی,ابھی اس کی ضرورت تھی,عباس تابش
1308,میں اس دنیا کے اک گوشے میں بیٹھا سوچتا ہوں,ابھی اس کی ضرورت تھی,عباس تابش
1309,آج اس ویران منڈلی میں,ابھی اس کی ضرورت تھی,عباس تابش
1310,میں کس کو پرسہ دینے کے لیے آیا ہوں,ابھی اس کی ضرورت تھی,عباس تابش
1311,مجھ کو تعزیت تو خود سے کرنا تھی,ابھی اس کی ضرورت تھی,عباس تابش
1312,ابھی اس گھر سے اک میت سدھاری ہے,ابھی اس کی ضرورت تھی,عباس تابش
1313,دم رخصت,ابھی اس کی ضرورت تھی,عباس تابش
1314,کسی نے نکہت زلف پریشاں کا نہیں پوچھا,ابھی اس کی ضرورت تھی,عباس تابش
1315,کسی نے دکھ کے اندر روشنی کی چھب نہیں دیکھی,ابھی اس کی ضرورت تھی,عباس تابش
1316,مکاں سے پھوٹنے والی روش پر,ابھی اس کی ضرورت تھی,عباس تابش
1317,ایک بچہ رو رہا ہے,ابھی اس کی ضرورت تھی,عباس تابش
1318,آج اس کے آنسوؤں کو کون پونچھے گا,ابھی اس کی ضرورت تھی,عباس تابش
1319,کہ اس کے ساتھ جو شطرنج کی بازی لگاتا تھا,ابھی اس کی ضرورت تھی,عباس تابش
1320,وہ اب زیر زمیں اک چادر سادہ کی خوشبو ہے,ابھی اس کی ضرورت تھی,عباس تابش
1321,یہاں صبحیں بھی آئیں گی,ابھی اس کی ضرورت تھی,عباس تابش
1322,یہاں شامیں بھی اتریں گی,ابھی اس کی ضرورت تھی,عباس تابش
1323,مگر اک ہچکیاں لیتا ہوا بچہ,ابھی اس کی ضرورت تھی,عباس تابش
1324,چراغ آرزو بن کر,ابھی اس کی ضرورت تھی,عباس تابش
1325,سر طاق لحد گونگی زمیں کی لب کشائی تک پکارے گا,ابھی اس کی ضرورت تھی,عباس تابش
1326,برا ہو موت کا جس نے مرے فریاد رس کی جان لے لی ہے,ابھی اس کی ضرورت تھی,عباس تابش
1327,وہ کیسی ہے,اسے میں نے نہیں دیکھا,عباس تابش
1328,اسے میں نے نہیں دیکھا,اسے میں نے نہیں دیکھا,عباس تابش
1329,سنا ہے وہ زمیں زادی,اسے میں نے نہیں دیکھا,عباس تابش
1330,دھنک سے اپنے خوابوں کے افق گل رنگ رکھتی ہے,اسے میں نے نہیں دیکھا,عباس تابش
1331,مرے خاشاک سے آگے کسی منظر میں رہتی ہے,اسے میں نے نہیں دیکھا,عباس تابش
1332,ہوا کے گھر میں رہتی ہے,اسے میں نے نہیں دیکھا,عباس تابش
1333,وہ کس سورج کا حصہ ہے,اسے میں نے نہیں دیکھا,عباس تابش
1334,وہ کس تارے کی مٹی ہے,اسے میں نے نہیں دیکھا,عباس تابش
1335,اسے میں نے نہیں دیکھا,اسے میں نے نہیں دیکھا,عباس تابش
1336,مری آنکھوں سے لے کر اس کی آنکھوں تک کسے معلوم ہے,اسے میں نے نہیں دیکھا,عباس تابش
1337,کتنے ستارے ہیں,اسے میں نے نہیں دیکھا,عباس تابش
1338,مجھے کیا علم وہ کس رنگ کے کپڑے پہنتی ہے,اسے میں نے نہیں دیکھا,عباس تابش
1339,وہ خالی برتنوں میں اپنا دن کیسے بتاتی ہے,اسے میں نے نہیں دیکھا,عباس تابش
1340,وہ خوشیاں ڈھونڈتی ہے اور خود کو بند الماری میں رکھ کر,اسے میں نے نہیں دیکھا,عباس تابش
1341,بھول جاتی ہے,اسے میں نے نہیں دیکھا,عباس تابش
1342,وہ گھر کے لان میں بیٹھی بہت کچھ سوچتی ہوگی,اسے میں نے نہیں دیکھا,عباس تابش
1343,کہ میرا رنگ کیسا ہے,اسے میں نے نہیں دیکھا,عباس تابش
1344,مری آنکھوں کے روشن قمقموں میں تاب کتنی ہے,اسے میں نے نہیں دیکھا,عباس تابش
1345,مری شریان میں سہمے ہوئے بچوں پہ کیا گزری,اسے میں نے نہیں دیکھا,عباس تابش
1346,وہ کس رستے پہ چل نکلے کہ اپنے گھر نہیں پہنچے,اسے میں نے نہیں دیکھا,عباس تابش
1347,وہ اکثر سوچتی ہوگی,اسے میں نے نہیں دیکھا,عباس تابش
1348,مرے کمرے میں بوڑھی فاحشہ تنہائی کے ہوتے,اسے میں نے نہیں دیکھا,عباس تابش
1349,مرے دن کیسے کٹتے ہیں,اسے میں نے نہیں دیکھا,عباس تابش
1350,مری بے خواب راتیں کن خیالوں میں گزرتی ہیں,اسے میں نے نہیں دیکھا,عباس تابش
1351,کہاں عشق گریزاں کی کہانی ختم ہوتی ہے,اسے میں نے نہیں دیکھا,عباس تابش
1352,وہ گھر کے لان میں بیٹھی یہی کچھ سوچتی ہوگی,اسے میں نے نہیں دیکھا,عباس تابش
1353,کہ میرے نام کے پیچھے مری تصویر کیسی ہے,اسے میں نے نہیں دیکھا,عباس تابش
1354,مرے خط بھی نہیں اس کے تصرف میں,اسے میں نے نہیں دیکھا,عباس تابش
1355,کہ ان کو کھول کر میرے بدن کے راز تک پہنچے,اسے میں نے نہیں دیکھا,عباس تابش
1356,مجھے اس نے نہیں دیکھا,اسے میں نے نہیں دیکھا,عباس تابش
1357,نہ میں نے اس کو دیکھا ہے,اسے میں نے نہیں دیکھا,عباس تابش
1358,نہ اس نے مجھ کو دیکھا ہے,اسے میں نے نہیں دیکھا,عباس تابش
1359,مگر اپنی محبت میں عجب حسن توازن ہے,اسے میں نے نہیں دیکھا,عباس تابش
1360,وہ اکثر سوچتی ہوگی,اسے میں نے نہیں دیکھا,عباس تابش
1361,میں کتنا اپنے دفتر میں ہوں کتنا گھر کی خلوت میں,اسے میں نے نہیں دیکھا,عباس تابش
1362,وہ مجھ کو مجھ پہ ہی تقسیم کر کے دیکھتی ہوگی,اسے میں نے نہیں دیکھا,عباس تابش
1363,مجھے محسوس ہوتا ہے,اسے میں نے نہیں دیکھا,عباس تابش
1364,کوئی دل چیرتی خوشبو مجھے آواز دیتی ہے,اسے میں نے نہیں دیکھا,عباس تابش
1365,مگر آواز کے پیچھے کوئی چہرہ نہیں ہوتا,اسے میں نے نہیں دیکھا,عباس تابش
1366,وہ مجھ کو دیکھ لیتی ہے,اسے میں نے نہیں دیکھا,عباس تابش
1367,مگر میری بصارت میں مہک چہرہ نہیں پاتی,اسے میں نے نہیں دیکھا,عباس تابش
1368,کہ خوشبو کس نے دیکھی ہے,اسے میں نے نہیں دیکھا,عباس تابش
1369,صدا کو کس نے پکڑا ہے,اسے میں نے نہیں دیکھا,عباس تابش
1370,مکانی دوریاں کیسی؟ زمانی قربتیں کیسی؟,اسے میں نے نہیں دیکھا,عباس تابش
1371,وہ میرا جسم ہے لیکن اسے میں نے نہیں دیکھا,اسے میں نے نہیں دیکھا,عباس تابش
1372,میری بستی میں بہت دیر سے سناٹا ہے,بشر زندہ ہے,عارف اختر نقوی
1373,نہ کہیں نالہ و شیون نہ کوئی شور بکا,بشر زندہ ہے,عارف اختر نقوی
1374,پر کہیں دور بہت دور کسی کوچے سے,بشر زندہ ہے,عارف اختر نقوی
1375,ہولے ہولے سسکنے کی صدا آئی ہے,بشر زندہ ہے,عارف اختر نقوی
1376,سن کے یہ گریۂ افتادہ تسلی سی ہوئی,بشر زندہ ہے,عارف اختر نقوی
1377,میری بستی میں ابھی کوئی بشر زندہ ہے,بشر زندہ ہے,عارف اختر نقوی
1378,ختم ہو جائے گی یہ رات سحر زندہ ہے,بشر زندہ ہے,عارف اختر نقوی
1379,کیا عجب کہ یہی موہوم سی آواز,بشر زندہ ہے,عارف اختر نقوی
1380,یہی سسکاری,بشر زندہ ہے,عارف اختر نقوی
1381,ایک دن شور بکا بن جائے,بشر زندہ ہے,عارف اختر نقوی
1382,ایک اعلان وغا بن جائے,بشر زندہ ہے,عارف اختر نقوی
1383,پرانے بوٹ ہیں تسمے کھلے ہیں,سلونی سردیوں کی نظم,عامر سہیل
1384,ابھی مٹی کے چہرے ان دھلے ہیں,سلونی سردیوں کی نظم,عامر سہیل
1385,شرابیں اور مشکیزہ سحر کا,سلونی سردیوں کی نظم,عامر سہیل
1386,ابھی ہے جسم پاکیزہ گجر کا,سلونی سردیوں کی نظم,عامر سہیل
1387,ستے چہرے پہ استہزا کا موسم,سلونی سردیوں کی نظم,عامر سہیل
1388,لہو نبضوں سے خالی کر گیا ہے,سلونی سردیوں کی نظم,عامر سہیل
1389,گلے میں ملک کے تعویذ ڈالو,سلونی سردیوں کی نظم,عامر سہیل
1390,بدیسی برچھیوں سے ڈر گیا ہے,سلونی سردیوں کی نظم,عامر سہیل
1391,غزل دالان میں رکھی ہے میں نے,سلونی سردیوں کی نظم,عامر سہیل
1392,مہک ہے سنگترے کی قاش جیسی,سلونی سردیوں کی نظم,عامر سہیل
1393,یہ کیسی مے ہے جو چکھی ہے میں نے,سلونی سردیوں کی نظم,عامر سہیل
1394,مجھے عشاق یہ کہتے ہیں عامرؔ,سلونی سردیوں کی نظم,عامر سہیل
1395,بہت تنہا سسکتے دہر میں ہو!,سلونی سردیوں کی نظم,عامر سہیل
1396,بڑے شاعر ہو چھوٹے شہر میں ہو,سلونی سردیوں کی نظم,عامر سہیل
1397,فریب عصر سے مدہوش کمرا,سلونی سردیوں کی نظم,عامر سہیل
1398,نگوڑی تتلیوں سے بھر گیا ہے,سلونی سردیوں کی نظم,عامر سہیل
1399,سمندر پنڈلیوں تک آتے آتے,سلونی سردیوں کی نظم,عامر سہیل
1400,کسی پتھر کی سل پر مر گیا ہے,سلونی سردیوں کی نظم,عامر سہیل
1401,سلونی سردیوں سے جھانکتے ہیں,سلونی سردیوں کی نظم,عامر سہیل
1402,وہ ابرو کشتیوں کو ہانکتے ہیں,سلونی سردیوں کی نظم,عامر سہیل
1403,سلیٹی بادلوں کا یہ صحیفہ,سلونی سردیوں کی نظم,عامر سہیل
1404,مری مٹھی میں پڑھتا ہے وظیفہ,سلونی سردیوں کی نظم,عامر سہیل
1405,میں روتا ہوں تو رو پڑتے ہیں طائر,سلونی سردیوں کی نظم,عامر سہیل
1406,مرے حجرے میں کم آتے ہیں زائر,سلونی سردیوں کی نظم,عامر سہیل
1407,یہ پوریں نور بافی کر رہی ہیں,سلونی سردیوں کی نظم,عامر سہیل
1408,محبت کو غلافی کر رہی ہیں,سلونی سردیوں کی نظم,عامر سہیل
1409,تفاخر میں ہے دو ہونٹوں کا خم بھی,سلونی سردیوں کی نظم,عامر سہیل
1410,ابھی رکھا نہیں میں نے قلم بھی,سلونی سردیوں کی نظم,عامر سہیل
1411,اے خدا,بے یقینی کا صحرا,عارف اختر نقوی
1412,تیرا لاچار بندہ,بے یقینی کا صحرا,عارف اختر نقوی
1413,تشنہ لب بے سہارا,بے یقینی کا صحرا,عارف اختر نقوی
1414,بے یقینی کے صحرا میں تنہا کھڑا ہے,بے یقینی کا صحرا,عارف اختر نقوی
1415,کتابوں سے لہجوں سے لفظوں سے میرا یقیں اٹھ چکا ہے,بے یقینی کا صحرا,عارف اختر نقوی
1416,ہر طرف شور ہے کھوکھلے الفاظ و اظہار کا,بے یقینی کا صحرا,عارف اختر نقوی
1417,صرف پرچار کا,بے یقینی کا صحرا,عارف اختر نقوی
1418,سب عقیدے نظریے,بے یقینی کا صحرا,عارف اختر نقوی
1419,محض اشتہارات ہیں,بے یقینی کا صحرا,عارف اختر نقوی
1420,ڈھول پیٹے چلے جا رہے ہیں,بے یقینی کا صحرا,عارف اختر نقوی
1421,اس قدر شور ہے کہ سماعت بھی پتھرا گئی ہے,بے یقینی کا صحرا,عارف اختر نقوی
1422,اس قدر روشنی کے بصارت بھی دھندلا گئی,بے یقینی کا صحرا,عارف اختر نقوی
1423,اے خدا,بے یقینی کا صحرا,عارف اختر نقوی
1424,روشنی کے اندھیرے میں اک نور دے,بے یقینی کا صحرا,عارف اختر نقوی
1425,نور ایسا کہ جس سے منور ہو دل,بے یقینی کا صحرا,عارف اختر نقوی
1426,ابر رحمت یقیں کا,بے یقینی کا صحرا,عارف اختر نقوی
1427,بے یقینی کے صحرا پہ سایہ فگن ہو,بے یقینی کا صحرا,عارف اختر نقوی
1428,کیا یہی زندگی ہے کہ ہم,دعا,عارف اختر نقوی
1429,اپنے ہونے کی خوشیاں مناتے رہیں,دعا,عارف اختر نقوی
1430,جسم کی لذتوں نفس کی شہوتوں میں بھٹکتے رہیں,دعا,عارف اختر نقوی
1431,سارے بے آسرا غم گزیدوں کو عبرت کا ذریعہ سمجھ کر,دعا,عارف اختر نقوی
1432,اپنی آسائشوں نعمتوں کے لیے سجدۂ شکر میں اپنے سر کو جھکاتے رہیں,دعا,عارف اختر نقوی
1433,کیا یہی زندگی ہے,دعا,عارف اختر نقوی
1434,کیا یہی زندگی ہے کہ ہم,دعا,عارف اختر نقوی
1435,غاصبوں زرپرستوں سے نظریں چرا کر,دعا,عارف اختر نقوی
1436,بے کسوں بے سہاروں کو صبر و قناعت کی تلقین کرتے رہیں,دعا,عارف اختر نقوی
1437,گر یہی زندگی ہے تو میرے خدا,دعا,عارف اختر نقوی
1438,چھین لے ہم سے اپنی خلافت کا منصب,دعا,عارف اختر نقوی
1439,کہ ہم واقعی اس کے لائق نہیں,دعا,عارف اختر نقوی
1440,ورنہ اے میرے رب رحم کر رحم کر,دعا,عارف اختر نقوی
1441,زندگی دی ہے ہم کو تو پھر,دعا,عارف اختر نقوی
1442,زندگی کا سلیقہ سکھا دے,دعا,عارف اختر نقوی
1443,مجھے تم سے کوئی محبت نہ الفت,میرا سایہ,عارف اختر نقوی
1444,تعلق بھی اب ہے برائے تعلق,میرا سایہ,عارف اختر نقوی
1445,مگر تم سے جب بھی ملا ہوں,میرا سایہ,عارف اختر نقوی
1446,مجھے میرا سایہ,میرا سایہ,عارف اختر نقوی
1447,جسے میں وہیں چھوڑ آیا,میرا سایہ,عارف اختر نقوی
1448,جہاں وہ خیالوں کی وادی میں,میرا سایہ,عارف اختر نقوی
1449,خواہش کی تتلی کے پیچھے اڑا جا رہا تھا,میرا سایہ,عارف اختر نقوی
1450,تمہاری گھنی زلف کی بدلیوں میں,میرا سایہ,عارف اختر نقوی
1451,زمیں سے بہت دور لیکن,میرا سایہ,عارف اختر نقوی
1452,میرے پیر میں ڈور ایسی بندھی تھی,میرا سایہ,عارف اختر نقوی
1453,کہ جس نے مجھے بدلیوں سے اٹھا کر,میرا سایہ,عارف اختر نقوی
1454,زمیں پر بٹھا کر,میرا سایہ,عارف اختر نقوی
1455,میرے چاروں جانب کئی دائرے بن دئے ہیں,میرا سایہ,عارف اختر نقوی
1456,ہے دشوار جن سے نکلنا,میرا سایہ,عارف اختر نقوی
1457,مگر تم سے جب بھی ملا ہوں,میرا سایہ,عارف اختر نقوی
1458,مجھے میرا سایہ بہت یاد آیا,میرا سایہ,عارف اختر نقوی
1459,میں شہر تمنا کی تاراج نگری کے ملبے میں,کاش,عارف اختر نقوی
1460,لاچار و تنہا,کاش,عارف اختر نقوی
1461,کبھی اس کھنڈر پر کبھی اس کھنڈر تک,کاش,عارف اختر نقوی
1462,بھٹکتا ہوا,کاش,عارف اختر نقوی
1463,ڈھونڈتا پھر رہا ہوں,کاش,عارف اختر نقوی
1464,اپنے معصوم مسمار خوابوں کا ملبہ,کاش,عارف اختر نقوی
1465,تبھی اک طرف کو نظر جو گئی تو دکھائی دیا,کاش,عارف اختر نقوی
1466,ٹوٹے پھوٹے جلائے گئے کچھ مکاں,کاش,عارف اختر نقوی
1467,ایک مینار مسجد,کاش,عارف اختر نقوی
1468,کلش ایک مندر کا اوندھا پڑا ہے,کاش,عارف اختر نقوی
1469,کریدا تو ملبے کے نیچے میرا خواب,کاش,عارف اختر نقوی
1470,سانجھی وراثت کا ایک ساز بھی دفن تھا,کاش,عارف اختر نقوی
1471,مجھے یاد آیا,کاش,عارف اختر نقوی
1472,میرے اماں ابا نے اس ساز پر,کاش,عارف اختر نقوی
1473,کتنے الفت کے نغمے بجا کر سکھائے تھے ہم کو,کاش,عارف اختر نقوی
1474,جوانی میں,کاش,عارف اختر نقوی
1475,اس ساز کی نرم دل کش دھنوں پر,کاش,عارف اختر نقوی
1476,بڑے جوش اور حوصلے سے,کاش,عارف اختر نقوی
1477,ترانے محبت کے گائے تھے ہم نے,کاش,عارف اختر نقوی
1478,مگر پھر,کاش,عارف اختر نقوی
1479,روح پرور اذانوں کی آواز,کاش,عارف اختر نقوی
1480,اور مندروں کے بھجن,کاش,عارف اختر نقوی
