,poem_line,nazm_name,author_name
1024,اسی شہر کی خواہش ہونے لگی,دھوپ میں بارش,عبدالقادر
1025,وہ شہر جو ہم سے چھوٹا ہے,دھوپ میں بارش,عبدالقادر
1026,اب اس کا نظارہ کیسا ہے,دھوپ میں بارش,عبدالقادر
1027,کس سے پوچھوں کیسے پوچھوں,دھوپ میں بارش,عبدالقادر
1028,ہر جان سے پیارا کیسا ہے,دھوپ میں بارش,عبدالقادر
1029,کیا اب بھی ہمارے ہمجولی,دھوپ میں بارش,عبدالقادر
1030,بے کار پڑے ہیں گاؤں میں,دھوپ میں بارش,عبدالقادر
1031,کیا اب بھی بیڑیاں لٹکی ہیں,دھوپ میں بارش,عبدالقادر
1032,ان دوڑنے والے پاؤں میں,دھوپ میں بارش,عبدالقادر
1033,کیا اب بھی پپیہا گاتا ہے,دھوپ میں بارش,عبدالقادر
1034,اس بوڑھے نیم کی گولی پر,دھوپ میں بارش,عبدالقادر
1035,کیا اب بھی موسم سرما میں,دھوپ میں بارش,عبدالقادر
1036,پھولوں کی نمائش ہوتی ہے,دھوپ میں بارش,عبدالقادر
1037,کیا اب بھی پتنگیں اڑتی ہیں,دھوپ میں بارش,عبدالقادر
1038,پاون چھٹ کے تہواروں میں,دھوپ میں بارش,عبدالقادر
1039,کیا اب بھی لوگ نہاتے ہیں,دھوپ میں بارش,عبدالقادر
1040,ساون کی پیاری پھواروں میں,دھوپ میں بارش,عبدالقادر
1041,کیا اب بھی لوگ نکلتے ہیں,دھوپ میں بارش,عبدالقادر
1042,ویسے ہی عید کے موقع پر,دھوپ میں بارش,عبدالقادر
1043,کیا اب بھی اپنے محلے میں,دھوپ میں بارش,عبدالقادر
1044,مہمان نوازی ہوتی ہے,دھوپ میں بارش,عبدالقادر
1045,کیا دن تھے وہ جو بیت گئے,دھوپ میں بارش,عبدالقادر
1046,کیا میرے سارے میت گئے,دھوپ میں بارش,عبدالقادر
1047,اے کاش کوئی لڑتا ہم سے,دھوپ میں بارش,عبدالقادر
1048,تم ہار گئے ہم جیت گئے,دھوپ میں بارش,عبدالقادر
1049,وہ اپنا بچپن کدھر گیا,دھوپ میں بارش,عبدالقادر
1050,وہ اپنی جوانی کہاں گئی,دھوپ میں بارش,عبدالقادر
1051,وہ شام جو پھر آئی ہی نہیں,دھوپ میں بارش,عبدالقادر
1052,وہ صبح سہانی کہاں گئی,دھوپ میں بارش,عبدالقادر
1053,کل رات گئی سب بات گئی,دھوپ میں بارش,عبدالقادر
1054,یعنی ساری سوغات گئی,دھوپ میں بارش,عبدالقادر
1055,بن موسم کے جو آئی تھی,دھوپ میں بارش,عبدالقادر
1056,مجھے رلا کے وہ برسات گئی,دھوپ میں بارش,عبدالقادر
1057,جب میں اس سے پوچھا تھا,دھوپ میں بارش,عبدالقادر
1058,اب شہر ہمارا کیسا ہے,دھوپ میں بارش,عبدالقادر
1059,کیا دھوپ میں بارش ہوتی ہے,دھوپ میں بارش,عبدالقادر
1060,کیاری خواہش ہوتی ہے,دھوپ میں بارش,عبدالقادر
1061,وہ ہنستے ہنستے رونے لگی,دھوپ میں بارش,عبدالقادر
1062,اور دھوپ میں بارش ہونے لگی,دھوپ میں بارش,عبدالقادر
1063,یہ قصہ ہے افیمی کا جو اک گاؤں میں رہتا تھا,افیمی کا قصہ,عبدالقادر عارف
1064,نشہ کرنے کی عادت تھی بہت ہی بھولا بھالا تھا,افیمی کا قصہ,عبدالقادر عارف
1065,لڑکپن گاؤں میں گزرا جوانی بھی وہیں گزری,افیمی کا قصہ,عبدالقادر عارف
1066,سیاحت کی تمنا تھی تو اس نے کر لی تیاری,افیمی کا قصہ,عبدالقادر عارف
1067,سویرے ایک دن گھر سے روانہ ہو گیا پیدل,افیمی کا قصہ,عبدالقادر عارف
1068,تھا کچا راستہ اور ہر طرف پھیلا ہوا جنگل,افیمی کا قصہ,عبدالقادر عارف
1069,سفر مغرب کی جانب تھا وہ چلتا ہی رہا سیدھا,افیمی کا قصہ,عبدالقادر عارف
1070,ہوئی جب دوپہر تو ایک برگد کا شجر دیکھا,افیمی کا قصہ,عبدالقادر عارف
1071,اسی برگد کے سائے میں افیمی سو گیا تھک کر,افیمی کا قصہ,عبدالقادر عارف
1072,مزے سے نیند لی ٹھنڈی ہوا میں اس نے گھنٹہ بھر,افیمی کا قصہ,عبدالقادر عارف
1073,ہوا بیدار تو مشرق کی جانب راہ لی اپنی,افیمی کا قصہ,عبدالقادر عارف
1074,خبر اس کو نہیں تھی سمت اس کی ہو گئی الٹی,افیمی کا قصہ,عبدالقادر عارف
1075,وہ چلتا ہی رہا اپنی ترنگ میں اور کوشش تھی,افیمی کا قصہ,عبدالقادر عارف
1076,پہنچ جاؤں کسی بستی میں رات آنے سے پہلے ہی,افیمی کا قصہ,عبدالقادر عارف
1077,غروب ہونے لگا سورج تو اپنے گاؤں میں پہنچا,افیمی کا قصہ,عبدالقادر عارف
1078,مگر سمجھا افیمی نے میں اگلے گاؤں میں پہنچا,افیمی کا قصہ,عبدالقادر عارف
1079,جب اس نے گاؤں کو دیکھا بہت یکسانیت پائی,افیمی کا قصہ,عبدالقادر عارف
1080,کہا یہ گاؤں لگتا ہے مرے دیہات کا بھائی,افیمی کا قصہ,عبدالقادر عارف
1081,دکانیں اور گلی کوچے مجھے ویسے ہی لگتے ہیں,افیمی کا قصہ,عبدالقادر عارف
1082,وہی شکل و شباہت کے یہاں انسان بستے ہیں,افیمی کا قصہ,عبدالقادر عارف
1083,میں جس بستی میں رہتا ہوں اسی کا سارا نقشہ ہے,افیمی کا قصہ,عبدالقادر عارف
1084,مجھے پورا یقیں ہے یہ مرے گاؤں کا چربہ ہے,افیمی کا قصہ,عبدالقادر عارف
1085,ہے میرا گھر بھی ایسا ہی جو میرے سامنے گھر ہے,افیمی کا قصہ,عبدالقادر عارف
1086,یہ گاؤں تو مرے دیہات کا جڑواں برادر ہے,افیمی کا قصہ,عبدالقادر عارف
1087,قدم گھر میں رکھا تو ایک محترمہ نظر آئی,افیمی کا قصہ,عبدالقادر عارف
1088,افیمی سمجھا وہ صورت مری بیگم کی جیسی ہے,افیمی کا قصہ,عبدالقادر عارف
1089,جو عورت اس مکاں میں ہے مری بیگم کی کاپی ہے,افیمی کا قصہ,عبدالقادر عارف
1090,ہوئی جب بات عورت سے تو یہ عقدہ کھلا اس پر,افیمی کا قصہ,عبدالقادر عارف
1091,یہی ہے میرا گاؤں میری بیگم اور میرا گھر,افیمی کا قصہ,عبدالقادر عارف
1092,تعجب تھا افیمی کو سفر میں پورا دن گزرا,افیمی کا قصہ,عبدالقادر عارف
1093,میں چلتا ہی رہا سیدھا تو کیسے اس جگہ پہنچا,افیمی کا قصہ,عبدالقادر عارف
1094,افیمی نے جب اپنی عقل کے گھوڑے کو دوڑایا,افیمی کا قصہ,عبدالقادر عارف
1095,سمجھ دانی سے فوراً حل معمے کا نکل آیا,افیمی کا قصہ,عبدالقادر عارف
1096,زمیں کا پورا چکر میں نے اک دن میں لگایا ہے,افیمی کا قصہ,عبدالقادر عارف
1097,عظیم الشان کرتب ما بدولت نے دکھایا ہے,افیمی کا قصہ,عبدالقادر عارف
1098,زمیں ہے گول اس دعوے کو ثابت کر دیا میں نے,افیمی کا قصہ,عبدالقادر عارف
1099,ثبوت اپنے سفر سے آج حاصل کر لیا میں نے,افیمی کا قصہ,عبدالقادر عارف
1100,آتا ہے یاد مجھ کو بچپن کا وہ زمانہ,بچپن کا وہ زمانہ,عبدالقادر
1101,رہتا تھا ساتھ میرے خوشیوں کا جب خزانہ,بچپن کا وہ زمانہ,عبدالقادر
1102,ہر روز گھر میں ملتے عمدہ لذیذ کھانے,بچپن کا وہ زمانہ,عبدالقادر
1103,بے محنت و مشقت حاصل تھا آب و دانہ,بچپن کا وہ زمانہ,عبدالقادر
1104,بچوں کے ساتھ رہنا خوشیوں کے گیت گانا,بچپن کا وہ زمانہ,عبدالقادر
1105,دل میں نہ تھی کدورت تھا سب سے دوستانہ,بچپن کا وہ زمانہ,عبدالقادر
1106,مہندی کے پتے لانا اور پیس کر لگانا,بچپن کا وہ زمانہ,عبدالقادر
1107,پھر سرخ ہاتھ اپنے ہر ایک کو دکھانا,بچپن کا وہ زمانہ,عبدالقادر
1108,آواز ڈگڈگی کی جوں ہی سنائی دیتی,بچپن کا وہ زمانہ,عبدالقادر
1109,اس کی طرف لپکنا بچوں کا والہانہ,بچپن کا وہ زمانہ,عبدالقادر
1110,ہر سال پیارے ابو لاتے تھے ایک بکرا,بچپن کا وہ زمانہ,عبدالقادر
1111,چارہ اسے کھلانا میدان میں گھمانا,بچپن کا وہ زمانہ,عبدالقادر
1112,وہ دور جا چکا ہے آتا نہیں پلٹ کر,بچپن کا وہ زمانہ,عبدالقادر
1113,بچپن کا وہ زمانہ لگتا ہے اک فسانہ,بچپن کا وہ زمانہ,عبدالقادر
1114,دادی کو میں نے اک دن یہ مشورہ دیا تھا,بچپن کا وہ زمانہ,عبدالقادر
1115,چہرے کی جھریوں کو آسان ہے مٹانا,بچپن کا وہ زمانہ,عبدالقادر
1116,چہرے پہ آپ کے ہیں جو بے شمار شکنیں,بچپن کا وہ زمانہ,عبدالقادر
1117,آیا مری سمجھ میں ان سے نجات پانا,بچپن کا وہ زمانہ,عبدالقادر
1118,کپڑے کی ساری شکنیں مٹتی ہیں استری سے,بچپن کا وہ زمانہ,عبدالقادر
1119,آسان سا عمل ہے یہ استری چلانا,بچپن کا وہ زمانہ,عبدالقادر
1120,اک گرم استری کو چہرے پہ آپ پھیریں,بچپن کا وہ زمانہ,عبدالقادر
1121,عمدہ ہے میرا نسخہ ہے شرط آزمانا,بچپن کا وہ زمانہ,عبدالقادر
1122,اک روز والدہ سے جا کر کہا کچن میں,بچپن کا وہ زمانہ,عبدالقادر
1123,اب چھوڑیئے گا امی یہ روٹیاں پکانا,بچپن کا وہ زمانہ,عبدالقادر
1124,اک پیڑ روٹیوں کا دالان میں لگائیں,بچپن کا وہ زمانہ,عبدالقادر
1125,اس پیڑ کو کہیں گے روٹی کا کارخانہ,بچپن کا وہ زمانہ,عبدالقادر
1126,شاخوں سے تازہ تازہ پھر روٹیاں ملیں گی,بچپن کا وہ زمانہ,عبدالقادر
1127,توڑیں گے روٹیاں ہم کھائیں گے گھر میں کھانا,بچپن کا وہ زمانہ,عبدالقادر
1128,کیسی عجیب باتیں آتی تھیں میرے لب پر,بچپن کا وہ زمانہ,عبدالقادر
1129,آج ان کو کہہ رہا ہوں باتیں ہیں احمقانہ,بچپن کا وہ زمانہ,عبدالقادر
1130,وہ پیاری پیاری باتیں اب یاد آ رہی ہیں,بچپن کا وہ زمانہ,عبدالقادر
1131,بچپن کا وہ زمانہ کیا خواب تھا سہانا,بچپن کا وہ زمانہ,عبدالقادر
1132,جب آگ جلی ناف کے نیچے تو زمیں پھیل گئی,زمین ان کے لئے پھول کھلاتی ہے,عباس اطہر
1133,آگ جلی اور بدن پھیل گئے,زمین ان کے لئے پھول کھلاتی ہے,عباس اطہر
1134,آنکھوں کی آوارگی بے رنگ ہوئی,زمین ان کے لئے پھول کھلاتی ہے,عباس اطہر
1135,دھوپ ہوا چاندنی,زمین ان کے لئے پھول کھلاتی ہے,عباس اطہر
1136,سب بستیوں میں خاک اڑی,زمین ان کے لئے پھول کھلاتی ہے,عباس اطہر
1137,قافلے ہی قافلے تھے,زمین ان کے لئے پھول کھلاتی ہے,عباس اطہر
1138,قافلے جو درد کے وطنوں سے چلے,زمین ان کے لئے پھول کھلاتی ہے,عباس اطہر
1139,چلتے گئے اجنبی خوشبو کی طرف,زمین ان کے لئے پھول کھلاتی ہے,عباس اطہر
1140,اس کی طرف جس کے لیے ساری کتابوں میں لکھا ہے,زمین ان کے لئے پھول کھلاتی ہے,عباس اطہر
1141,وہ کبھی ہاتھ نہیں آتی کبوتروں سے چٹاتی ہے,زمین ان کے لئے پھول کھلاتی ہے,عباس اطہر
1142,مگر رات کے دروازے پہ پہنچے تو ستارے نہ ملے,زمین ان کے لئے پھول کھلاتی ہے,عباس اطہر
1143,لوگ ابھی صبح کی امید میں شب کاٹتے ہیں,زمین ان کے لئے پھول کھلاتی ہے,عباس اطہر
1144,لوگ دکھی لوگ اکیلے ہیں,زمین ان کے لئے پھول کھلاتی ہے,عباس اطہر
1145,انہیں راستہ دو سینے سے چمٹا لو,زمین ان کے لئے پھول کھلاتی ہے,عباس اطہر
1146,ہر اک راستے میں جلتی ہوئی آگ بجھا دو کہ بدن,زمین ان کے لئے پھول کھلاتی ہے,عباس اطہر
1147,پھیلتے جاتے ہیں زمیں تنگ ہوئی جاتی ہے,زمین ان کے لئے پھول کھلاتی ہے,عباس اطہر
1148,جو آگ بجھانے کے لئے آئے تھے,زمین ان کے لئے پھول کھلاتی ہے,عباس اطہر
1149,سب خاک ہوئے لوٹ نہیں پائے,زمین ان کے لئے پھول کھلاتی ہے,عباس اطہر
1150,ہوا ان کے لئے دستکیں دیتی ہے,زمین ان کے لئے پھول کھلاتی ہے,عباس اطہر
1151,زمیں ان کے لیے پھول کھلاتی ہے,زمین ان کے لئے پھول کھلاتی ہے,عباس اطہر
1152,یہاں ہارن بجانے کی اجازت نہیں,چپ چاپ گزر جاؤ,عباس اطہر
1153,اور میں نے تمنا کا بھرم کھول دیا ہے کہ سمندر کی ہوا,چپ چاپ گزر جاؤ,عباس اطہر
1154,سینے سے ٹکرائے تو پردہ نہ رہے,چپ چاپ گزر جاؤ,عباس اطہر
1155,اس کی مہک سر پہ کفن باندھ کے نکلی ہے,چپ چاپ گزر جاؤ,عباس اطہر
1156,ہر اک راستے ہر موڑ پہ آواز لگاتی ہے,چپ چاپ گزر جاؤ,عباس اطہر
1157,مگر کوئی نہیں رکتا بسنت آئی ہے,چپ چاپ گزر جاؤ,عباس اطہر
1158,سب بھاگ رہے ہیں کوئی آواز نہیں دیتا,چپ چاپ گزر جاؤ,عباس اطہر
1159,کوئی مڑ کے نہیں دیکھتا,چپ چاپ گزر جاؤ,عباس اطہر
1160,پٹرول لہو اور ہوا دست و گریباں ہیں,چپ چاپ گزر جاؤ,عباس اطہر
1161,جدھر دیکھو پتنگیں ہی پتنگیں ہیں,چپ چاپ گزر جاؤ,عباس اطہر
1162,زمینوں پہ اترنے کے لئے ڈولتی پر تولتی,چپ چاپ گزر جاؤ,عباس اطہر
1163,بل کھاتی ہوئی,چپ چاپ گزر جاؤ,عباس اطہر
1164,صبح کو کٹتی ہیں مگر شام کو سڑکوں پہ اترتی ہیں,چپ چاپ گزر جاؤ,عباس اطہر
1165,تو وہ کون ہے جو,چپ چاپ گزر جاؤ,عباس اطہر
1166,آنکھوں کے سائے سے گریزاں ہیں,چپ چاپ گزر جاؤ,عباس اطہر
1167,مگر صبح ہی صبح چپکے سے سو سیڑھیاں,چپ چاپ گزر جاؤ,عباس اطہر
1168,چڑھ جاتا ہے تھکتا ہی نہیں,چپ چاپ گزر جاؤ,عباس اطہر
1169,اور نئی آگ دہکتی ہے,چپ چاپ گزر جاؤ,عباس اطہر
1170,نئے رنگے ہوئے کاغذوں سے حشر چمک اٹھتا ہے,چپ چاپ گزر جاؤ,عباس اطہر
1171,سب عورتیں اور مرد جواں لڑکیاں اور لڑکے,چپ چاپ گزر جاؤ,عباس اطہر
1172,نئی ٹیکسیاں اور موٹریں اور رکشے,چپ چاپ گزر جاؤ,عباس اطہر
1173,انہیں لوٹنے نکلے ہیں بسنت آئی ہے,چپ چاپ گزر جاؤ,عباس اطہر
1174,آ جاؤ یہاں لوٹ مچی ہے آؤ,چپ چاپ گزر جاؤ,عباس اطہر
1175,در و دیوار کو حسرت کی نظر دیکھنا مت بھولنا,چپ چاپ گزر جاؤ,عباس اطہر
1176,اک دوسرے کو روندتے,چپ چاپ گزر جاؤ,عباس اطہر
1177,اک دوسرے کو خون میں بھیگے ہوئے,چپ چاپ گزر جاؤ,عباس اطہر
1178,سر پیٹتے اور چیختے چلاتے سبھی بھاگ رہے ہیں,چپ چاپ گزر جاؤ,عباس اطہر
1179,کوئی آواز نہیں دیتا,چپ چاپ گزر جاؤ,عباس اطہر
1180,یہاں ماؤں اور بہنوں سے اور بیویوں سے,چپ چاپ گزر جاؤ,عباس اطہر
1181,آخری بوسوں کی اجازت ہے,چپ چاپ گزر جاؤ,عباس اطہر
1182,مگر ہارن بجانے کی اجازت نہیں,چپ چاپ گزر جاؤ,عباس اطہر
1183,مجھے رستہ نہیں ملتا,مجھے رستہ نہیں ملتا,عباس تابش
1184,میں جوہڑ میں کھلے پھولوں کے حق میں بول کر,مجھے رستہ نہیں ملتا,عباس تابش
1185,دلدل کی تہہ میں دھنس گیا ہوں,مجھے رستہ نہیں ملتا,عباس تابش
1186,میں نہیں کہتا کہ یہ کس آسماں کا کون سا سیارۂ بد ہے,مجھے رستہ نہیں ملتا,عباس تابش
1187,مگر یہ تہہ زمیں کی آخری چھت ہے,مجھے رستہ نہیں ملتا,عباس تابش
1188,یہاں دن ہی نکلتا ہے نہ شام عمر ڈھلتی ہے,مجھے رستہ نہیں ملتا,عباس تابش
1189,پرندہ بھی نہیں کوئی کہ جس کے پاؤں سے کوئی,مجھے رستہ نہیں ملتا,عباس تابش
1190,نوشتہ باندھ کر بھیجوں تو سمجھوں اس سے ملنے کا,مجھے رستہ نہیں ملتا,عباس تابش
1191,بہانہ ہاتھ آیا ہے,مجھے رستہ نہیں ملتا,عباس تابش
1192,ستارہ بھی نہیں کوئی کہ جس سے گفتگو ٹھہرے,مجھے رستہ نہیں ملتا,عباس تابش
1193,نواح جسم میں پھیلی خضر آثار تنہائی مری سانسیں بڑھاتی ہے,مجھے رستہ نہیں ملتا,عباس تابش
1194,مجھے اس دلدلی گوشے سے جانے کا کوئی رستہ نہیں ملتا,مجھے رستہ نہیں ملتا,عباس تابش
1195,سن اے میری خضر آثار تنہائی,مجھے رستہ نہیں ملتا,عباس تابش
1196,مری خاطر بھی تھوڑا سا تردد کر,مجھے رستہ نہیں ملتا,عباس تابش
1197,مجھے بھی تو سکندرؔ کے جنازے میں پہنچنا ہے,مجھے رستہ نہیں ملتا,عباس تابش
1198,مجھے بھی آب حیواں سے چھلکتی موت کا نوحہ سنانا ہے,مجھے رستہ نہیں ملتا,عباس تابش
1199,مجھے بھی دور جانا ہے,مجھے رستہ نہیں ملتا,عباس تابش
1200,سن اے میری خضر آثار تنہائی,مجھے رستہ نہیں ملتا,عباس تابش
1201,مجھے اس تخم امکاں کے دریچے سے نکلنے دے,مجھے رستہ نہیں ملتا,عباس تابش
1202,نمو کی چال چلنے دے,مجھے رستہ نہیں ملتا,عباس تابش
1203,مجھے رستہ نہیں ملتا,مجھے رستہ نہیں ملتا,عباس تابش
1204,''نئی سڑکوں کے نقشے'' کارخانے,اپنے اپنے سوراخوں کا ڈر,عباس اطہر
1205,اونچے اونچے پل مرے منصوبے دیکھو اور کتابوں میں پڑھو'',اپنے اپنے سوراخوں کا ڈر,عباس اطہر
1206,اس نے کہا۔۔۔ ''میرے بدن پر ہاتھ بھی پھیرو,اپنے اپنے سوراخوں کا ڈر,عباس اطہر
1207,مگر سوراخ سے انگلی الگ رکھو'',اپنے اپنے سوراخوں کا ڈر,عباس اطہر
1208,مگر اس کے بدن پر ہر طرف سوراخ ہی سوراخ ہیں,اپنے اپنے سوراخوں کا ڈر,عباس اطہر
1209,انگلی الگ رکھو!,اپنے اپنے سوراخوں کا ڈر,عباس اطہر
1210,تو کیا میں انگلیوں کو توڑ دوں؟,اپنے اپنے سوراخوں کا ڈر,عباس اطہر
1211,میں انگلیوں کو توڑ دوں؟,اپنے اپنے سوراخوں کا ڈر,عباس اطہر
1212,پھر کون تیرے حسن کی تفسیر لکھے گا؟ بتا!,اپنے اپنے سوراخوں کا ڈر,عباس اطہر
1213,پھر یہ تسلسل رات دن کا,اپنے اپنے سوراخوں کا ڈر,عباس اطہر
1214,چاند سورج کا اکیلے موسموں کا,اپنے اپنے سوراخوں کا ڈر,عباس اطہر
1215,مسئلوں اور مشکلوں کا,اپنے اپنے سوراخوں کا ڈر,عباس اطہر
1216,کیسے ٹوٹے گا؟ بتا!,اپنے اپنے سوراخوں کا ڈر,عباس اطہر
1217,اس نے ہمیں ایک دوسرے سے چھپ کے رہنے کے لئے,اپنے اپنے سوراخوں کا ڈر,عباس اطہر
1218,کپڑے دیئے اور خوب صورت گھر دیے,اپنے اپنے سوراخوں کا ڈر,عباس اطہر
1219,اور بند کمروں میں زمینوں آسمانوں کی سبھی سچائیاں کہنے اور ان,اپنے اپنے سوراخوں کا ڈر,عباس اطہر
1220,پر بحث کرنے اور منصوبے بنانے کی کھلی آزادی دی,اپنے اپنے سوراخوں کا ڈر,عباس اطہر
1221,یارو! چلو سڑکوں پہ ننگے سیر کرنے جائیں,اپنے اپنے سوراخوں کا ڈر,عباس اطہر
1222,شاید رسم چل نکلے,اپنے اپنے سوراخوں کا ڈر,عباس اطہر
1223,مگر میرے قبیلے کا کوئی بھی مرد,اپنے اپنے سوراخوں کا ڈر,عباس اطہر
1224,کپڑے پھاڑ کر گھر کو جلا کے,اپنے اپنے سوراخوں کا ڈر,عباس اطہر
1225,ننگی ننگی باتیں کہنے کے لئے باہر نہ نکلا,اپنے اپنے سوراخوں کا ڈر,عباس اطہر
1226,سب کو اپنے اپنے سوراخوں کا ڈر تھا,اپنے اپنے سوراخوں کا ڈر,عباس اطہر
1227,نیک دل لڑکیو,نیک دل لڑکیو,عباس اطہر
1228,آرزو کی نمائش سے گزرو تو چاروں طرف دیکھنا,نیک دل لڑکیو,عباس اطہر
1229,اور پھر جب تمہارے لہو میں کسی کا لہو سرسرائے,نیک دل لڑکیو,عباس اطہر
1230,ستاروں میں آنکھیں چھپا کر دعا مانگنا,نیک دل لڑکیو,عباس اطہر
1231,قیدیوں شاعروں اور محکوم آبادیوں کے لئے,نیک دل لڑکیو,عباس اطہر
1232,اور بیمار بچوں کی ماں کے لئے,نیک دل لڑکیو,عباس اطہر
1233,اور پھر نرم ہونٹوں کی حدت سے,نیک دل لڑکیو,عباس اطہر
1234,جب چھاتیوں میں ہوا سنسناتی سنو,نیک دل لڑکیو,عباس اطہر
1235,نیک دل لڑکیو یاد کرنا انہیں جن کی قیمت بھی لکھے ہوئے دائرے,نیک دل لڑکیو,عباس اطہر
1236,ایک سے رات دن اور تنہائیاں ہیں,نیک دل لڑکیو,عباس اطہر
1237,ہمارے لئے چاند نکلے نہ نکلے کہ ٹہنیوں سے بچھڑ کے سنبھلنے نہ پائے,نیک دل لڑکیو,عباس اطہر
1238,ہواؤں کے کندھوں پہ روتے ہوئے دور ہوتے گئے,نیک دل لڑکیو,عباس اطہر
1239,اور جب لوٹنے کی حدوں سے بھی آگے نکل آئے,نیک دل لڑکیو,عباس اطہر
1240,پیچھے سے آواز آئی پلٹ آؤ,نیک دل لڑکیو,عباس اطہر
1241,ہم نے تمہارے لئے آج آنسو بہائے ہیں,نیک دل لڑکیو,عباس اطہر
1242,ہم رات کے میہماں ہیں مگر نیک دل لڑکیو,نیک دل لڑکیو,عباس اطہر
1243,آرزو کی نمائش میں چاروں طرف دیکھنا,نیک دل لڑکیو,عباس اطہر
1244,اور آنکھوں کی تحریر پڑھنا,نیک دل لڑکیو,عباس اطہر
1245,ہماری طرف جب تمہارے سفر کا مسافر ہوا کے ستم سے گزرنے لگے,نیک دل لڑکیو,عباس اطہر
1246,اس سے کہنا ٹھہر جاؤ,نیک دل لڑکیو,عباس اطہر
1247,میرے لہو میں تمہارے لئے آرزو ہے,نیک دل لڑکیو,عباس اطہر
